,0
0,Which 2020 Democrats Are Strongest on Climate? Here’s the List.
1,Climate Change and the Death of the Small Farm
2,The GOP’s answer to catastrophic climate change? Trolling the libs.
3,Ocasio-Cortez’s righteous — and accurate — anger about poverty and the environment
4,Polar bear climate change
5,Worsening Algae Blooms Could Significantly Increase Global Methane Emissions
6,"Push for more coal power in China imperils efforts to fight climate change, researchers say | Straits Times"
7,The vault holding humanity’s precious seeds is on thin ice: the area where it's located “is probably warming faster than in any other town on Earth.”
8,"Dad Recently sent me this video, and I could use some help disproving it with facts"
9,New study shows IPCC is underselling climate change
10,"Pete Buttigieg, US presidential candidate, signs the No Fossil Fuel Money pledge"
11,Climate scientists have a moral responsibility to lead by example
12,AOC: Climate Change “Not An Elitist Issue”
13,This was pretty funny and on point (although apparently made for Finnish audience). Every action matters and we need to act today for the climate!
14,"The electrification of air travel begins: Harbour Air to convert all its seaplanes to electric, becoming the first all-electric airline"
15,"Republicans bash the Green New Deal, but they’re struggling for an alternative"
16,"Children are fighting for their future, and we must support them"
17,"People Actually Like the Green New Deal | Mitch McConnell’s show vote in the Senate on Tuesday rejected the plan, but Republicans may come to regret their mockery."
18,A senator’s argument against the Green New Deal: A machine gun-toting Ronald Reagan riding a velociraptor
19,GOP Senator Says Having More 'American Babies' Is The Solution To Climate Change
20,"Where’s Your Climate Plan, Mr. McConnell? The Senate Republican leader staged a sham vote on a Democratic climate change resolution, embarrassing only himself."
21,The Green New Deal and carbon taxes can work together
22,The US coal industry shows a low-carbon transition could be anything but orderly
23,"After shared bicycle graveyards, China now also has shared car dumping grounds | 5,000 cars abandoned near Hangzhou | Global Times"
24,"Big oil pumps $1 billion into climate change lobbying, execs laugh about Trump access"
25,"The destruction of Cyclone Idai in Mozambique, seen from above"
26,Senator Mike Lee on Senator AOC’s and Senator Markey's Green New Deal.
27,The Conversation No One Knows How to Have - Meteorologist Nick Humphrey
28,"The Green New Deal does not pass in the senate; most Democrats, including co-sponsors voted 'Present' due to a lack of appropriate hearings"
29,"Survey on what would make low-emissions travel better enough that you'd want to take it, in the U.S."
30,Climate change denial is evil
31,Oil And Gas Giants Spend Millions Lobbying To Block Climate Change Policies
32,Most Americans Support Reducing Fossil Fuel Use
33,"Poll: Climate change denial drops in SC, but residents more polarized over the cause"
34,Green New Deal Vote Sets Up Climate Change As Key 2020 Issue
35,Oregon close to finalizing cap-and-trade bill
36,Oceanic carbon uptake could falter
37,The world's first climate treaty turns 25
38,"How to Deal with Chaos in Climate and Politics- In complex systems, small changes can make big differences"
39,Trees release flammable methane - here's what that means for climate
40,"Yes, a Greenland glacier is growing. No, that doesn't mean that melting is over."
41,Here's what Warren Buffett thinks about climate change
42,"On Tuesday, Klawock, Alaska topped out at 70 degrees Fahrenheit. That marks the earliest 70-degree Fahrenheit day ever recorded in Alaska. The previous record was set just three years ago"
43,Climate Change Impairs Trees’ Recovery from Wildfires
44,"In blow to climate, coal plants emitted more than ever in 2018 -- Scientist: ’We are headed for disaster, and nobody seems to be able to slow things down.'"
45,Bar Chart Race – the countries with the largest CO2 emissions in the world from 1850 to 2017
46,Alpine glaciers: Another decade of loss
47,"Senator Alexander (R-TN) acknowledges that climate change is real, humans are responsible, and resumes his calls for a 'Manhattan Project for Clean Energy' of a decade ago"
48,McConnell to Put Green New Deal to Test Vote in First of Many Showcases
49,What Do Eco-Socialists Have to Say About the Climate Movement?
50,Radical transformation pathway towards sustainable electricity via evolutionary steps
51,Adapting To Climate Change In Miami
52,Guterres tells countries to bring plans not speeches to climate conference...
53,Using coal for electric generation now pricier than solar or wind in many locations; will be true for the entire US by 2025
54,Explainer: How scientists estimate climate sensitivity
55,This technology is making hydro electricity more affordable. How scalable can a tech like this be?
56,Gallup: Americans as Concerned as Ever About Global Warming
57,Copenhagen Wants to Show How Cities Can Fight Climate Change
58,About Carbon Pricing in Canada
59,"McConnell aims to use Green New Deal to divide Democrats, but party is unifying against his show vote"
60,"Deep breadth: The Green New Deal is sweeping, as it must be"
61,"Lawyers Ramp Up Challenges to Trump’s Oil Drilling Push, Citing Climate Impact"
62,"What is the ""Green"" in the Green New Deal?"
63,Can David Wallace-Wells Scare Us Into Addressing Climate Change?
64,"Climate change denial is delusion, and the biggest threat to human survival"
65,Farmers in the Midwest Face Decades of Recovery as Flooding Strips Away Crucial Soil [climate change is a force multiplier]
66,Black Hawk's 11 Percent Solution
67,Climate changes make some aspects of weather forecasting increasingly difficult - Science Daily
68,California Climate Policy Dashboard | Berkeley Law
69,Trump ally says that climate change is real
70,The Climate Flag
71,Fracking plan ‘will release same C02 as 300m new cars’
72,Climate change's fingerprints are on U.S. Midwest floods: scientists
73,"Flood, Disease, and Famine: How Cyclone Has Devastated Mozambique, Zimbabwe and Malawi"
74,Record Temperatures 20-25C Above Norm in far North
75,A reason to hope: Factcheck: Is 3-5C of Arctic warming now ‘locked in’?
76,Guest post: Why results from the next generation of climate models matter
77,Behind the Scenes of the Fossil Fuel Industry’s War on Humanity’s Future
78,Cyclone Idai: rich countries are to blame for disasters like this
79,"""Greetings from Berlin, Tokyo, Beijing"" – Should we call time on international academic travel?"
80,"Reforestation Drones Drop Seeds Instead of Bombs, Planting 100,000 Trees Per Day Each"
81,Catastrophic flooding: what we know about how climate change and how it's related
82,Global Warming
83,Millions Of Fossil Fuel Dollars Are Being Pumped Into Anti-Climate Lobbying
84,World Economic Forum - How climate change affects extreme weather
85,Rejecting the gravity of climate change equates to 'reckless disregard'
86,Gaetz drafting ‘Green Real Deal’ climate resolution
87,Midwest floods foreshadow national security threat posed by climate change
88,Talk at Stanford last week by Designing Climate Solutions author Hal Harvey
89,It looks like German car manufacturers are going all-in on electrification
90,A Map of the Future of Water: how a changing climate and groundwater depletion will interact to create water stress
91,New Mexico enacts law requiring electric generation to fully decarbonize by 2045
92,How to get involved with a local group to create the political will for climate action
93,We’re Living in the Warmest Decade Since Record-Keeping Began (xpost r/StopFossilFuels)
94,The State Clean Energy Cookbook
95,8 Lessons for Today’s Activism: A Millennial’s Advice to Youth Movements
96,Busy? Here’s a Fast Way to Stay Informed About All Things Climate Change
97,CCL Lobby Days &amp; Conference in June
98,"Cyclone Shows Climate Change’s Deadly Impact on Poor, Urbanizing Nations"
99,Let's get it done!
100,Being presented with clear factual information endorsed by a trusted – evangelical – source can change the minds of some US climate deniers
101,Interactive: Can the Great Barrier Reef survive climate change?
102,Oil Giants Invest $110 Billion In New Fossil Fuels After Spending $1 Billion On Green PR
103,"Oil and gas majors have spent $1 billion undermining climate action since 2015, report says"
104,Donald Trump is using Stalinist techniques against climate science | Michael Mann and Bob Ward
105,"EU Parliament urged to strip ExxonMobil lobbyists of access badges because parliamentary rules say ""lobbyists shall have their access badges denied"" when they refuse without good reason to comply with a formal summons to attend a committee hearing or inquiry."
106,Climate change could make insurance too expensive for most people – report
107,"What is this guy on? He’s also said that because our climate predictions aren’t 100% accurate humans can’t be causing climate change. Cited sources, he ignores them. Like talking to a brick wall."
108,Polluted by Money: how corporate cash was able to pay to block climate and other environmental legislation in Oregon
109,The first results from a new generation of global climate models suggest the amount warming we can expect from doubling the CO₂ concentration is between 2.8°C and 5.8°C. This is higher than the estimates from an earlier generation of models
110,"Looking for weather/climate info on humidity, rain and temperatures"
111,Cyclone Idai shows the deadly reality of climate change in Africa
112,Electric cars won't shrink emissions enough - we must cut travel too
113,Earth Hour 2019
114,"A blog I wrote regarding organizations using labels to raise awareness about climate change, including making people aware of the carbon footprint they're leaving behind when buying food and pumping gas."
115,The Club of Rome Supports Global Student Climate Protests • Club of Rome
116,BP Lobbied Trump Administration to Roll Back Key US Climate Rules
117,"Great Lakes Basin warming faster than other parts of country, new study finds"
118,Minnesota's famed winter isn't what it used to be
119,"The waters are rising, the floods are coming. What are we doing to save ourselves?"
120,"Citing climate change, U.S. judge blocks oil and gas drilling in large swath of Wyoming"
121,The Seductive Stupidity of Andrew Wheeler | The EPA chief's latest argument against fighting climate change is astonishingly foolish—but it's exactly what most of us want to hear.
122,"How to solve climate change? There are a thousand answers. From the Green New Deal’s progressive platform for policies to the more modest and moderate carbon pricing options and everything in between, there are a thousand ways to solve climate change."
123,Key Democrat Paul Tonko unveils 'doable' climate change plan to attract Republicans
124,The hockey stick graph showing the sudden rise in temperature after the industrial revolution turns 20
125,The Fight to Tame a Swelling River With Dams That May Be Outmatched by Climate Change
126,How can I use software to aid fighting climate change?
127,Could you post here every useful link you know that helps to comprehend all the problems connected with climate change?
128,Wow
129,"The New GOP Answer to Climate Change: It Exists, But Just Rely on 'Innovation,' Nuclear To Save The Day"
130,"Since 2016, Half of All Coral in the Great Barrier Reef Has Died"
131,"“I’m looking at global warming — I don’t need to see the graphs,” said Hamburg’s mayor, Cathy Crain, referring to the role of climate change in increasing the frequency of extreme weather events"
132,The tone of the IPCC's probabilistic language is remarkably conservative
133,"Earlier this month, scientists watched a 25-mile-wide section of the Thwaites ice shelf ice crumble into the sea. This ice shelf buttresses the glacier itself, providing stability and in effect holding it back from slipping faster into the sea."
134,The New GOP Answer to Climate Change: It Exists But Just Rely on 'Innovation' and Nuclear To Save the Day
135,A federal judge ruled late Tuesday that the Interior Department violated federal law by failing to take into account the climate impact of its oil and gas leasing in the West -- this means that they'll need to provide updated documentation of what the climate impacts will be before proceeding
136,"For first time since records began, NWT hits 20C in March"
137,Climate Change Debate talking points
138,Exxon’s Climate Denial Set To Face First Public Scrutiny As Legal Woes Mount
139,Green New Deal: 6 places already reducing emissions from buildings
140,"The ironic turth about climate change is that the most vulnerable countries to climate change are not the countires that have been the main culprit to climate change, that have been creating it."
141,How to Overcome Humanity’s Immune Reaction to Acting on Climate Goals and How to Craft a More Inspiring Story
142,Good on china
143,"The science on climate change is real, the crisis is here, and we need to act"
144,Banking on Climate Change 2019: which banks are financing the fossil fuels industry
145,Michael Mann and Bob Ward: Donald Trump is using Stalinist techniques against climate science
146,'It's pathetic': Elizabeth May reacts to climate measures in budget (Canada)
147,Report: Carbon-capture group gets some serious lobbying muscle
148,"Ruined crops, salty soil: How rising seas are poisoning North Carolina’s farmland"
149,Looking For Some Direction on a Reaserch Project
150,"Blockchain is overhyped, but it’s also perfect for California’s climate drought problem"
151,"I have a family member who firmly believes climate change is a hoax. If you could only pick one article or source to try to change someone's mind about climate change, what would you show them?"
152,[Speech] Dr. Howard Dryden: Save the oceans and we save the planet
153,"To My Fellow Climate Scientists: Be Human, Be Brave, Speak Truth"
154,Why I want to bring odious and polluting global aviation down to Earth
155,Sharp rise in Arctic temperatures now inevitable – UN
156,"How have CO₂ emissions developed compared to previous generations of emission scenarios? Turns out that when you include land use, we're tracking a bit under RCP8.5"
157,Climate Advocates Cheer Trump Policy Shift on Flood Insurance
158,New coal mine in Cumbria 'unanimously approved' despite climate change emergency
159,State-of-the-art global models underestimate impacts from climate extremes
160,"America Cares About Climate Change Again: For the first time in years, a broad spectrum of climate advocates is playing offense"
161,Some Democrats running for president have pledged to not take fossil fuel money. Some have not.
162,"How PG&amp;E overlooked rising wildfire risks as temperatures rose, resulting in short term profit followed by bankruptcy"
163,The disconnect between the Trump administration and reality on climate change keeps growing
164,"The students are right, we have failed them on climate change"
165,New Trailer for Our Planet.
166,Protecting indigenous lands protects the environment. Trump and Bolsonaro threaten both.
167,"Exxon’s Climate Denial Set To Face First Public Scrutiny As Legal Woes Mount - On Thursday, European Parliament members are set to hold a hearing in Brussels that could strip Exxon Mobil of lobbying access and deepen the oil giant’s mounting legal woes."
168,I took this photo of a lone protestor outside UK parliament at the school climate strikes.
169,"British Columbia First Nations’ Failing Fisheries: as water warms, marine creatures are migrating—away from First Nations’ territory."
170,"Extreme events and anthropogenic emissions: Formal attribution of anthropogenic influences to extreme events is difficult. This doesn't, however, mean that we can't link these events to anthropogenically-driven global warming."
171,England could run short of water within 25 years -- water demand from the country’s rising population expected to surpass the falling supply resulting from climate change.
172,AP finds hot records falling twice as often as cold ones
173,Climate science is not ‘liberal propaganda’ – Harriet Sweatman
174,February 2019 ranked fifth hottest on record for the globe. Now 410 consecutive months that the world surface temps have been above average.
175,"David Suzuki fires off from the 'death zone' at Trudeau, Weaver and a broken system"
176,What is a realistic timeline for the effects of climate change on humans?
177,"Beto O’Rourke is right on climate, and the AP ‘fact-check’ is wrong: Experts back O’Rourke's warning that ‘we have no more than 12 years’ for bold climate action"
178,Airline Pollution Is Soaring and Nobody Knows How to Fix It
179,"We must accept finite disappointment, but never lose infinite hope!"
180,Some studies indicate that the factors that led to the type of storm that struck the Great Plains last week and caused record flooding are increasing
181,Ending climate change requires the end of capitalism. Have we got the stomach for it?
182,"What do you think? Is this necessary infrastructure for a renewable future, or techno-hopium that ignores the need for even more radical change?"
183,Penn State Offers Free Online Course on the Human Dimensions of Global Warming
184,The deep Southern Ocean is key to more intense ice ages
185,Advantages and disadvantages of Wind Energy
186,‘One chance at survival’: Jay Inslee is running for president to fight climate change
187,These Photos of Kids Protesting Climate Change All Over the World Will Give You Hope for the Future
188,The Trump administration is opening millions of new acres to drilling — and that’s just the start
189,Congestion Pricing Is New York’s Green New Deal
190,Auditor general on climate change: Each disaster is ‘a hit to the state’s taxpayers’
191,Would the Green New Deal Survive the Supreme Court?
192,Salvini supporters are calling for Greta Thunberg to be assassinated
193,The number 1 individual action to reduce emissions is to have one less child. Has this information impacted your family planning at all?
194,IPCC report in 2018 recommend huge reductions of emissions ... this what happened to the Australian coal industry the same year. Anybody see the problem?
195,Corporate Media Keeps Ignoring Climate Change
196,"Reading Hal Harvey’s new book about selecting a tightly focused set of policies to get maximum greenhouse gas reductions when time is tight, like now. My question is who is “best in class” at influencing policy at state legislatures and quasi judicial bodies like PUCs?"
197,"To save the planet, use your voice: like hundreds of thousands of youth did Friday... cast aside the learned helplessness that infects so many of us, and bravely use your voice."
198,150K Montreal kids at #FridaysForFuture #schoolstrike4climate..cinematic video
199,Finnish scientists fact-check climate media claims - turns out Greta Thunberg has done her science homework
200,It’s time for climate change communicators to listen to social science
201,Ice-free Arctic summers could happen on earlier side of predictions
202,We need to live differently
203,CO2 Emissions by Country (1800-2014)
204,"As temperatures rise, the hotter, drier air and drier soil conditions are increasingly unsuitable for young Douglas firs and ponderosa pines to take root and thrive in some low-elevation forests in the American west"
205,How climate change is sinking an Indian island
206,The Ides of the Climate Crisis
207,"Debunking: ""Climate Change Model Predictions Are Unreliable!"""
208,Top Countries by CO2 Emissions 1975-2014 | StatJuice
209,"Recent cold snaps and winter storms have taken over the news media with some claiming, “How can global warming be happening when it’s below zero?!” The answer is that the long-term warming trend results in both hot and cold short-term temperature extremes and this article, will explain why"
210,How do we know that the increase of temperature is the cause of droughts and more storms.
211,Come and join our FridaysForFuture subreddit!!! 💪😁
212,Is biodiversity collapse just racist shorthand for third world industrialisation?
213,A World Without Clouds: A state-of-the-art supercomputer simulation indicates that a feedback loop between global warming and cloud loss can push Earth’s climate past a disastrous tipping point in as little as a century.
214,We Don't Mine Enough Rare Earth Metals to Replace Fossil Fuels With Renewable Energy
215,'Whole thing is unravelling': climate change reshaping Australia's forests
216,Toxic air breaks families in Mongolia
217,"Serious food for thought. We Face A Crisis Bigger Than Climate Change, But We're Not Talking About It."
218,"Schools, climate strikes and internationalism"
219,"The Climate Apocalypse Is Now, and It’s Happening to You"
220,50 demands to stop #climatechange.
221,Who's behind Trump's claim the Green New Deal will cost $100 trillion?
222,Updated Mapped: How climate change affects extreme weather around the world
223,Factcheck: Is 3-5C of Arctic warming now ‘locked in’?
224,Amazing Montreal climate strike
225,"One of the ways that oil drilling in the US has been limited is via protections for threatened and endangered species. The Trump regime just finalized a plan strip away protections for the sage grouse on nearly nine million acres of land in the West, which will open that area to oil drilling"
226,U.S. blocks U.N. Resolution on Geoengineering
227,Climate campaigners need to be extremely vigilant about eco-fascist discourse
228,Climate Science Basics – clear and simple
229,Right-wing lawmakers have climate change education in their scopes in these states: Arizona. North Dakota. Florida. Iowa. South Dakota. Virginia. Montana. Oklahoma. Maine. Connecticut.
230,“There’s no Planet B” - Youth climate strike in Lisbon 3.15.2019
231,Climate change: The essential guide for both young and old
232,Youth movement in Eugene OR
233,"The youth climate strike in Palo Alto, California, speaking with Congresswoman Anna Eshoo in her office"
234,The climate strikers’ urgency has inspired me to call a UN summit | António Guterres
235,Youth Leadership Needed In Time Of Climate Uncertainty
236,Support HR 763 the Energy Innovation &amp; Carbon Dividends Act
237,O'Rourke Endorses The 'Green New Deal': 'The Future of the World Depends On Us'
238,Concrete: the most destructive material on Earth | Cities
239,"Student protest in Portsmouth, NH."
240,'They chose us because we were rural and poor': when environmental racism and climate change collide | Environment
241,Why Nuclear Power Can't Solve Climate Change by Itself
242,"Green New Deal vs. Carbon Tax: A Clash of 2 Worldviews, Both Seeking Climate Action"
243,Can someone please help me with a point-by-point rebuttal of this pseudoscience article that my family is pushing down my throat claiming climate change is not cause by CO2 emissions.
244,Pictures From the Youth Climate Strikes Worldwide
245,"Students protesting in Novara, Italy. Climate change is real ant we should call it ""climate crisis"". Fight for your future"
246,"Thousands out for climate strike in Bern, Switzerland"
247,Uganda’s Young Climate Activists Are Going on Strike
248,Student demonstration in Paris. It was soooo crowded. I'm so proud of all the students that came today. Hopefully next week I can come demonstrate with them earlier
249,Schoolchildren around the world are on climate strike. Here’s what you need to know.
250,The Age of Stupid revisited: what's changed on climate change?
251,Climate strikes: U.S. students skipping school as part of global action | Protests organized by children and teens in almost every state will call for the implementation of the Green New Deal.
252,“I’m Fighting for My Future”—A Climate Change Generation Is Making Itself Heard | Youth school strikes around the world are just the start.
253,This 9-Year-Old Is Mad at You for Failing on Climate Change
254,Want to help reduce the changing climate? Stop having babies and adopt.
255,Climate protest in copenhagen
256,Demonstration in Lund.
257,The Climate Benefits of the Green New Deal
258,Danish demonstration about climate change
259,"Weekend quiz: Can you name all the demagogues, climate liars, mafiosi and racist terrorists in this celebrity far-right jigsaw?"
260,Speeding Toward Irrevocable Climate Chaos
261,Bill McKibben: A Future Without Fossil Fuels?
262,Devastating Arctic warming of 9-16°F now locked in UN researchers warn
263,"El Nino conditions strengthened in February and are now expected to persist through the spring and summer, according to an outlook issued by NOAA: https://wxch.nl/2Hkqk61"
264,The Secret of Oily Wells - A campaign to expose how Wells Fargo serves as Big Oil's favorite banker
265,Fossil Fuel Industry Groups Spent $1.4 billion in PR &amp; advertising from 2007-2018
266,Climate scientists show their support for youth climate strikes in the United States and around the world
267,Low-carbon heating to replace gas in new UK homes after 2025
268,A Green Capitalist Solution to Climate Change – Pumping Sulphur Dioxide into the Atmosphere
269,Climate study warns of vanishing safety window and here's why
270,Climate Change Reading List
271,Teenage climate activist Greta Thunberg nominated for Nobel Peace Prize | World News
272,Is Fox News actually reporting sensibly on climate change now?
273,Man rescued from ice drifting in Bering Sea describes hours jumping from floe to floe
274,Students Across the World Are Protesting on Friday. They want action on climate.
275,Dutch to introduce corporate CO2 tax as climate plans fall short
276,‘Our future is what we are fighting for’: Meet the schoolkids going on strike over climate change
