,0
520,"Heavy snow on Maui. Historic floods on Kauai. Hawaii weather is getting weird: In early February, more than a foot of snow blanketed Polipoli Spring State Recreation Park on Maui — elevation 6,200 feet. Though records are spotty, it’s believed to be the lowest elevation snowfall in modern Hawaii."
521,We need to live differently
522,The challenge of tackling aviation's non-CO2 emissions
523,"With Climate Science on the March, an Isolated Trump Hunkers Down"
524,"Earth's fish are disappearing because of climate change, study says: The scientists said they were ""stunned"" to discover that global warming has significantly affected fish stocks worldwide and warned that the decline could threaten the livelihoods and food supplies of millions of people."
525,"Geoengineering, or “What Could Possibly Go Wrong?” (pdf excerpt from Mann's ""The Madhouse Effect..."")"
526,The World Is Losing Fish to Eat as Oceans Warm
527,"Andrew Wheeler, coal lobbyist who denies that climate change is an issue, and who has a history of rolling back regulation in order to increase emissions of greenhouse gasses and other pollutants, has been confirmed by the US senate, with Susan Collins as the only Republican to dissent"
528,Climate deniers reveal true fear about Green New Deal: That it will force Republicans to the left
529,"[crosspost] David Wallace-Wells, author of THE UNINHABITABLE EARTH and an editor and climate columnist at New York Magazine, is doing an AMA in r/IAmA!"
530,"McConnell wildly out of step with Kentucky and US on climate change | he’s received more than $3.3 million in campaign contributions from the coal, gas and oil industries"
531,"The energy cost burden on low-income families: how a warming world will make it worse in much of the US, and how efficiency measures can make it less bad"
532,Republican senator Susan Collins of Maine opposes Trump EPA pick over climate change
533,The Green New Deal is more feasible than you think
534,Pro-Trump Billionaires Continue To Bankroll Climate Denial | New tax filings show the Mercer family gave big money to think tanks that peddle misinformation.
535,As Governments’ Fail to Act on Climate Change – The People Step Up to the Plate
536,Questions
537,🐾 🐾 🐾 🐾
538,Another Ice Storm Video Proving That Global Warming Is Causing Insane Climate Changes
539,"Climate Hackers (28:19) - Can geoengineering slow climate change, or will it be used as an excuse not to cut emissions?"
540,"Homes lose $15.8 billion in value as seas rise, Maine to Mississippi"
541,"By Accepting Oil Money, Beto O'Rourke Broke a Promise to Environmentalists"
542,Fighting Climate Change With Nanomaterials
543,How a warming world impacts both summer and winter sports
544,"Economic factors are why US gasoline consumption fell between 2008 and 2012, not some desire by millennials to live a car-free life"
545,Warming Signs - a weekly podcast that tackles pressing environmental issues with wit and expertise
546,Costa Rica launches 'unprecedented' push for zero emissions by 2050
547,Climate change: Democratic lawmaker rips Donald Trump's panel on climate science as 'dangerous'
548,"99.9999 percent chance we're the cause of global warming, study says"
549,Supercut Shows Fox News Hosts Distorting Ocasio-Cortez's Climate Change Comments
550,"Green New Deal offers a possible route to conquer climate challenge- for the first time, we have a real plan to get up the mountain before it comes crashing down around us."
551,Support grows for carbon emissions bill that would return money to citizens
552,Most funny truth imo
553,Major study uncovers ‘sea change’ in world’s understanding of Atlantic conveyor belt
554,Carbon farming: how agriculture which maintains peat in soils can both feed people and fight climate change
555,The head of the Saudi national oil company is freaking out because the rest of the world is talking seriously about ending oil consumption
556,Overcoming the Ideology of Climate Inaction
557,Democrats Across the US Are Getting Hounded by Voters for Shying Away From the Green New Deal
558,The best case for worst case scenarios: The “end of the world” or “good for you” are the two least likely among the spectrum of potential climate outcomes
559,Explainer: Why some US Democrats want a ‘Green New Deal’ to tackle climate change
560,These six metals are key to a low-carbon future
561,Senate Democrats to offer unanimous climate resolution that's not the Green New Deal
562,Undergraduate level intro to climate science textbook?
563,Arctic Sea Ice: the Denier Viewpoint
564,"A world without clouds? Hardly clear, climate scientists say"
565,The P.G. &amp; E. Bankruptcy and the Coming Climate-Related Business Failures
566,How true is Peter Wadhams's claim that losing Arctic sea ice will increase warming by 50%? How much do temps really go up from losing the ice and snow in the Arctic? [cross-post from r/climate_science]
567,"Schumer vows to defund Trump's 'fake climate panel' -- Senate Minority Leader Chuck Schumer vowed to defund a climate science panel the White House is looking to create, calling it ""fake"" and criticizing Republican leaders for their positions on climate change."
568,Alaska's new governor has dismissed the state's climate team and scrapped its climate policy and plan - Arctic Today
569,Global Warming – The Skepticism Paradox
570,Climate Emergency Declaration places - Google My Maps
571,What is the real global carbon budget to keep global warming under 2 degrees? I see a wide range of numbers out there. Are negative emissions really a thing?
572,Inslee says tackling climate change would be top priority if he runs for president
573,"IEEFA report: Every two weeks a bank, insurer or lender announces new coal restrictions - 100 won't lend to coal companies or for coal burning"
574,"Young protesters arrested outside Sen. Mitch McConnell’s office demanding action on Green New Deal | Outside McConnell’s office Monday, young activists held up yellow signs that said “Green New Deal now — step up or step aside” and, “Mitch, look us in the eyes.”"
575,"John Kerry: Disband your climate denial panel, Mr. President | Instead of convening a kangaroo court, the president might want to talk with the adults he once trusted enough to fill his top national security positions."
576,Scientists Must Speak Up for the Green New Deal - The resolution’s focus on climate and social justice highlights the central challenges—and opportunities—of our time
577,"Evidence for man-made global warming hits 'gold standard': scientists | evidence for global warming reached the five sigma level by 2005 in two of three sets of satellite data widely used by researchers, and in 2016 in the third."
578,Don't trust the adults in the room on climate change- There’s an inspiring new slogan gaining traction among venerated pundits and politicians of a certain age that claim steadfast commitment to the cause of stopping catastrophic climate change: “Get off my lawn.”
579,"Hundreds of young protesters confront McConnell over Green New Deal | “You line your pockets while we die in floods and choke on the air we breathe, yet you don’t even have the decency to look us in the eyes.”"
580,Tweets tell scientists how quickly we normalize unusual weather
581,UK must stop investing in fossil fuels in developing countries
582,Australian Liberal politics at it's moronic best - again.
583,A World Without Clouds
584,"Climate change could zap clouds, bake the Earth even more"
585,"One of the few things which humans can do to cause an immediate rapid cooling would be to fight a nuclear war. An India-Pakistan nuclear war would cool the world by several degrees, leaving us with conditions similar to the global agricultural failures of 1816"
586,"John Kerry: Disband your climate denial panel, Mr. President"
587,Climate Change
588,"As waters have warmed, dissolved oxygen concentrations have dropped: Widespread and sometimes drastic marine oxygen declines are stressing sensitive species — a trend that will continue with climate change"
589,"Hey, Donald Trump: countries with more climate change policies are better at reducing emissions"
590,"Evidence of Human-Caused Climate Crisis Has Now Reached 'Gold Standard'-Level Certainty, Scientists Say"
591,Huge Increase In Arctic Shipping by Russia
592,Kevin Anderson on the 2C carbon budget (6:35 long)
593,Climate change: CO2 emissions fell between 2005 and 2015 in 18 countries with strong policies to cut emissions
594,Scott Morrison pledges $56m for Tasmanian interconnector in climate policy reboot
595,Can YouTube Solve Its Serious Climate Science Denial Problem?
596,Possible climate transitions from breakup of stratocumulus decks under greenhouse warming
597,A World Without Clouds
598,Exxon asks U.S. regulator to block climate-change resolution: investors
599,Super Typhoon Wutip Hits 155 mph: Strongest February Typhoon on Record
600,The Culprit Behind Trump's Border Emergency? Climate Change
601,It’s OK to believe in climate change and be a Republican
602,Meet the 12-year-old activist taking politicians to task over climate change
603,"The last time CO2 emissions were this high the Arctic had palm trees: ""It's terrifying"""
604,"This 10-Year-Old Is Fighting Climate Change By Ditching School | ""I do not want to play with dolls or Lego. This is what I want to do.”"
605,Explaining the increase in coal consumption worldwide
606,Meet the CO2-Praising Physicist Behind Latest Trump Climate Push | once compared the maligning of carbon dioxide to the “demonization of the poor Jews under Hitler.”
607,Can this battery tech work at large scale?
608,Want a Green New Deal? Here’s a better one.
609,The Green New Deal Is Better Than Our Climate Nightmare - Tackling climate change in a big way is in itself likely to be transformative. We should get on with it.
610,German climate law draft calls for net-zero emissions by 2050
611,Concrete: the most destructive material on Earth
612,"Australia launches climate change plan to tackle emissions: in the run up to an election the governing coalition is spending money to pay farmers and businesses to reduce emissions, rather than ending the use of coal"
613,"The Green New Deal's Big Idea: bring back governance with a national industrial policy, an approach to policy which dates back to Alexander Hamilton"
614,Why aren't we using nature to fight climate change?
615,Testing Projections from Old Climate Models
616,Exxon asks U.S. regulator to block climate-change resolution: investors
617,model the level of pollution of a lake in which a textile factory rejects its wastewater
618,Analysis: Why scientists think 100% of global warming is due to humans
619,The fierce urgency of climate change
620,How global media goes wrong on coverage of climate change
621,"White House to select federal scientists to reassess government climate findings, sources say | ""our own White House is attacking the very science agencies that can help the president understand and manage the climate risks to security of today and tomorrow,”"
622,Bernie Sanders talking to kids about climate change in 1987
623,Capitalism’s Ownership of Global Warming
624,"This is an emergency, damn it | Green New Deal critics are missing the bigger picture."
625,The Hard Lessons of Dianne Feinstein’s Encounter with the Young Green New Deal Activists
626,NYT editorial: The Green New Deal Is Better Than Our Climate Nightmare
627,"High-speed rail is in fact eating into domestic airline industries from Italy to China, making travel easier, cheaper, faster, and cleaner."
628,Does the U.S. need a ‘presidential climate security committee’?
629,Truth
630,"Majority of Americans now accept climate change, support carbon tax"
631,"Insurance not enough to offset financial risks of climate change, analysts say"
632,Climate change on canvas
633,atmospheric co2 record levels so far this year
634,Al Gore admits US poverty 'shocking' – but warns climate crisis will make things worse | US news
635,The (near) impossibility of taking climate change seriously (enough)
636,How to get people to take action to address climate change
637,A Carbon Tax Wave? 7 States Considering Carbon Pricing to Fight Climate Change
638,Heavy snow turns Arizona desert into eerie winter landscape
639,A group of schoolchildren met with Senator Feinstein today to ask her to support the Green New Deal. This is what happened.
640,"UK homes ‘shockingly unprepared’ for climate change, says CCC"
641,Disgraced lobbyist joins anti-Green New Deal effort as opposition to resolution takes shape
642,Michael Mann gives an interview where he ends by discussing the importance of taking political action to stabilize climate
643,And the Nobel Prize for Climate Change Goes To… – Nexus Media
644,Our children on strike for the climate! What about us? What do we do?
645,I found a solution for global warming...SLUGS!
646,Liberal Humiliates Tucker Carlson On Fox News!
647,AMA with climate scientist Katharine Hayhoe—a lead author of the US National Climate Assessment!
648,Alexandria Ocasio-Cortez's Green New Deal is right about transforming transportation — but we don't have to wait for its more ambitious goals
649,"Here's Trump's EPA Pick, Talking Climate Change. And Yes, We Fact-Checked Him"
650,"How Google, Microsoft, and Big Tech Are Automating the Climate Crisis"
651,"The Green New Deal in Congress: A good idea that doesn’t go far enough, fast enough"
652,"The Green New Deal Is the Only Realistic Option - If your greatest fear at this point is that the Green New Deal is too ambitious, you’re not just on the wrong side of history; you’re on the wrong side of humanity."
653,The Uninhabitable Earth: David Wallace-Wells on the horrors of climate change
654,"America landed a man on the moon. Climate change calls for the same bold, can-do spirit. | The Green New Deal is the first step in meeting the climate challenge, and yes, the devil is in the details. We need to start working on this now."
655,Can the Green New Deal make it through Congress? Here are 5 things you need to know.
656,"The Pathetic New Tactic Replacing Climate Change Denial - You can't really deny climate change is a thing anymore, but you can be a dick about the people trying to stop it."
657,Question: Why does it rain all year 'round in New Orleans?
658,The biggest and most influential tech companies are making deals and partnerships with oil companies which will result in extracting more fossil fuels
659,Energy efficiency contributed 25% of UK economic growth since 1971 -- this is what sustainable growth would look like in a decarbonized world
660,Carbon emissions may be reaching levels not seen for 56-million-years
661,Climate Denier to Head New Trump Panel Despite Once Comparing Climate Scientists to Nazis
662,Human vs Nature
663,And the Nobel Prize for Climate Change Goes To… – Nexus Media
664,"The energy market in the Southwest US has hit a turning point, with battery prices falling so low that the technology is now cheaper than natural gas peaker plants"
665,Trump regime ends talks with the state of California over the ability of California to set its own emissions standards. State officials have vowed to sue to protect that authority if the administration tries to impose weaker federal standards on California and the dozen states that follow its lead
666,Canada's health organizations demand action to prevent catastrophic climate change
667,"The Green New Deal: questions and answers discussing what it is, whether it will get a vote, and what it costs to do it, and not do it"
668,"President Trump is ignoring evidence on climate change – this time, from the Pentagon."
669,Gwynne Dyer: 'Little Ice Age' lessons unheeded
670,"The US House of Representatives Science Committee just held a helpful hearing on climate science for the first time in years: Once most members could agree that climate change is real, they could start talking about the real question of what to do."
671,US Senators not backing Green New Deal received on average 7 times as much fossil fuel cash as those backing it
672,Greta Thunberg tells EU: your climate targets need doubling | Environment
673,The Uninhabitable Earth: Unflinching New Book Lays Out Dire Consequences of Climate Chaos
674,Talking Climate: When Facts are Not Enough - Public Lecture featuring Katharine Hayhoe - livestream at 6:00pm Eastern Time on Feb. 26
675,How Entrepreneurs Can Help Developing Countries Hard Hit by Climate Change
676,Medical community must sound alarm about climate change’s negative effects on health
677,Senators Not Backing Green New Deal Received On Average 7 Times As Much Fossil Fuel Cash
678,"Climate threat doubter is leading effort to advise Trump | Happer has claimed that carbon dioxide, the main heat-trapping gas from the burning of coal, oil and gas, is good for humans and that carbon emissions have been demonized like “the poor Jews under Hitler.”"
679,How do i respond to this shit my mom keeps sending me? Shes a denier.
680,Climate change 'cause of most under-reported humanitarian crises'
681,"American consumers' use of toilet paper wiping out habitat, heating planet, report says"
682,Industrial-scale fake meat production potentially even worse for climate than livestock industry
683,Teachers to join climate protests to demand curriculum reform | Environment
684,"Youth climate movement gains steam, rallies behind landmark U.S. case"
685,Weekly Artic sea ice age between 1984 (how fitting) and 2016
686,US coastal businesses hit by everyday impact of climate change. Annapolis seeing sea rise at about twice the global rate. Flooding there foreshadows problems other coastal towns can expect
687,Observations and models agree that the oceans are warming faster
688,White House Panel Will Study Whether Climate Change Is a National Security Threat. It Includes a Climate Denialist.
689,Climate change officially claims its first mammal: The Bramble Cay melomys is declared extinct. (Stay tuned for the rest)
690,Climate Pessimism Gets Us Nowhere
691,"World Bank: Price tag for climate-smart infrastructure spending in developing countries is around 4½% of GDP, not much more than they currently spend on infrastructure"
692,Meat Is a Big Climate Issue. What About Dairy?
693,Arctic Bogs Hold Another Global Warming Risk That Could Spiral Out of Control
694,This could be a meeting of any school club—But these students are here to make plans to shut down schools across the country as part of a global climate strike.
695,Increasing precipitation whiplash in twenty-first century California : California Weather Blog
696,"Canada obliged to protect future generations from climate change, test case on carbon tax hears"
697,More than half of European Corporations have No CO2 Reduction Plans
698,"Can someone please help me respond to my uncle, a climate change denier?"
699,On Paying for a Progressive Agenda: the Green New Deal is worth borrowing for
700,Young climate strikers can win their fight. We must all help
701,Nine forest vital signs reveal the impacts of the climate
702,"Uranium Seawater Extraction Makes Nuclear Power Completely Renewable — ""It’s that uranium extracted from seawater is replenished continuously, so nuclear becomes as endless as solar, hydro and wind."""
703,Land management ‘blind spots’ make 1.5C goal highly unlikely
704,The War On Climate Change Won’t Be Won Quibbling Over The Green New Deal’s Costs
705,White House prepares to scrutinize intelligence agencies’ finding that climate change threatens national security
706,Revealed: How the Tobacco and Fossil Fuel Industries Fund Disinformation Campaigns Around the World
707,"Amy Klobuchar Calls Climate Change A ‘Day One’ Priority In Presidential Town Hall | But the Minnesota senator stopped short of endorsing the Green New Deal, calling it “aspirational.”"
708,"Adani, an international coal mining company, has a history of using intimidation tactics and frivolous lawsuits in Australia and other countries to discourage opposition"
709,"Jay Inslee, potential 2020 contender, on climate: 'We need to blow the bugle'"
710,"A carbon tax, without further measures, might have been enough if implemented worldwide three decades ago. Now, it is almost certainly not. A combination of something like the Green New Deal and a carbon tax is likely needed to stabilize the climate at a safe level."
711,"Glencore, Australia's biggest coal miner announces it will cap production and try to conduct its business in line with the Paris accords."
712,[VIDEO] Improving climate resilience in semi-arid rural Kenya
713,Vegetation and its effects on the climate
714,Climate change officially kills off its first mammal species.
715,a solution to climate change
716,Anti-fragility and Climate Change
717,"David Suzuki: You may not like insects, but you need them"
718,U.S. Ski Industry is Uniting Behind a List of Climate Change Actions to Save the Slopes
719,An Australian court has refused permission for the creation of a coking-coal mine in New South Wales on the grounds that it would adversely contribute to greenhouse gas emissions and would set back the fight against climate change.
720,"From Apple to Nestle, these are the companies hoping to profit from climate change"
721,'Grandfather Of Climate Science' Wallace Broecker Dies At 87
722,My boss just posted this (I work in municipal agriculture outreach programs in Canada)
723,"Global climate targets will be missed as deforestation rises, study says"
724,"Democrats Look To Declare National Emergency Over Climate Change, Not A ‘Fake Crisis’"
725,Several states have recently introduced bills that could interfere with the teaching of scientifically founded explanations of climate change in public school science curricula
726,"Yes, the Green New Deal is audacious. But we have no choice but to think big."
727,Who should change? Individuals or Corporations?
728,Analysis | Bernie Sanders’s 2020 policy agenda: Medicare for All; action on climate change; $15 an hour minimum wage
729,'Our little brown rat': first climate change-caused mammal extinction
730,Habitat for sale: An oil and gas group calls the tune at the Interior Department
731,MPs call for 1p clothing tax and darning classes in schools to cut waste and emissions
732,"As a Californian, goodbye"
733,"R.I.P. to William Smith Broecker. The Newberry Professor in the Department of Earth and Environmental Sciences at Columbia University, he wrote “Climatic Change: Are We on the Brink of a Pronounced Global Warming?” in August 1975 as a warning for humanity."
734,'Grandfather of climate science' dead at 87
735,“The Age of Climate Panic Is Here”
736,"Fossil Fuels (Not Wildfires) Biggest Source of a Key Arctic Climate Pollutant, Study Finds"
737,Climate Action in Europe: what is the EU doing about climate change and why it is not enough
738,Several states have recently introduced bills that could interfere with the teaching of scientifically founded theories on climate change in public school science curricula.
739,Surge in US economists’ support for carbon tax to tackle emissions
740,Does an IPCC scenarios list exist?
741,Canada's forests actually emit more carbon than they absorb
742,"With Climate Change, Washington, D.C. Will Feel More Like Arkansas by 2080"
743,How a 7th-grader’s strike against climate change exploded into a movement
744,US Students will deliver climate change resolutions to Congress
745,"Becoming Greta: ‘Invisible Girl’ to Global Climate Activist, With Bumps Along the Way"
746,"Agroecology is helping 100,000 farmers in the Sahel become more resilient to climate change"
747,"Climate action advocates have underestimated the strength and sophistication of decades-long fossil fuel-funded misinformation campaigns and need a coordinated set of strategies to fight back, say leading academics."
748,"A feature of science denial is incoherence: deniers aren't interested in a consistent explanation of the world so they'll grab onto any argument that opposes science, regularly taking on incoherent and contradictory explanations."
749,Reduce Internet usage to reduce global warming ?
750,Omar: Next president should declare national emergency on climate change ‘on day 1’
751,Why the Green New Deal makes me hopeful about climate change
752,The End of Ice: Climate science roundup—Interview w/Paul Beckwith—Radio Ecoshock 2019-02-14 (audio)
753,The hidden climate-change story behind Trump’s ‘national emergency’
754,"It's a start don't get me wrong, but at this rate we'd need 1,200 nations to do the same thing to stop our planet dying."
755,Associação ambientalista defende fim das isenções fiscais no combustível aéreo
756,Q&amp;A: Why cement emissions matter for climate change
757,It’s not by chance that those who lie about the climate also promote racist scapegoating
758,Australia to plant 1 billion trees to help meet climate targets
759,Humans
760,Sharp rise in methane levels threatens world climate targets
761,Why We Won’t Quit the Climate Fight (xpost r/StopFossilFuels)
762,Using Emergency Powers to Fight Climate Change
763,"""Why is it so hard to believe that thousands of young people from all around the world have been simultaneously inspired and have followed each other's lead with no other motive but the single shared goal of staying alive on our dying planet?' - Eric Holthaus"
764,Australia aims to plant a billion trees by 2050 as part of a new forestry plan the government says will help the country meet its Paris Agreement climate targets.
765,"Climate crisis requires us to invest in future, not subsidize the past"
766,Bill McKibben: Climate Change Is Scary—Not the Green New Deal
