,0
277,"“Not a single social problem can be resolved except through the establishment of a society based on social need, not private profit."
278,Students strike to demand action on climate change
279,A carbon tax should be the centerpiece of the Green New Deal
280,"Donald Trump’s Climate Denial Gets More Ridiculous By The Day - It’s one thing for Fox’s primary audience, with their failing faculties and dulled critical thinking skills, to be suckered in by their constant barrage of alternative facts and persuasive fictions."
281,"""Our future is what we are fighting for"": Meet the schoolkids going on strike over climate change"
282,[OC] A Climate Change infographic I made
283,Patrick Moore vs. Patrick Moore on Climate Change
284,New Zealand in shock after climate change minister attacked in park
285,My New Plan to Climate-Proof Lower Manhattan By Bill de Blasio
286,Redrawing the Map: How the World’s Climate Zones Are Shifting
287,Costa Rica has committed to ending domestic use of fossil fuels by 2050
288,Scientist support letter for US School Strikes for Climate - To read and To Sign
289,"Climate change is not only destroying the planet, but our psyches as well | First Dog on the Moon | Opinion"
290,"Resource extraction responsible for half world's carbon emissions: Extraction also causes 80% of biodiversity loss, according to comprehensive UN study"
291,Reforestation could be the solution to the climate crisis we’ve been looking for all along. Recent research suggests that a massive tree-planting initiative may be significantly more beneficial than it has been assumed in supporting biodiversity and combating climate chaos.
292,"Artists Declare a Climate Emergency Wednesday, March 13th – 7:00 pm EST"
293,Digital planet: How smart technologies can help us solve our climate and infrastructure challenges - OECD Observer
294,Wheeler's poison plan is a threat to families' health and safety
295,Patrick Moore is Fox News' New Anti-Climate Change Hero. Here's the Truth About His Background.
296,Trump tweets climate change skeptic in latest denial of science
297,Coal baron and LNP donor blasts RBA for sounding alarm on climate change
298,"Grown-Ups Get a Scolding on Climate- Inspired by a Swedish teenager, students around the world on Friday will protest political inaction."
299,Banks pumped $1.9 trillion into fossil fuels since the Paris climate deal
300,"Students are striking for action on climate change — a truancy everyone should applaud. Instead of studying history, it’s time to make it."
301,You Can Eat a Burger and Still Fight For the Planet
302,BP lobbied against US methane rules despite green public stance
303,"Wyoming’s coal plants are so unprofitable Republicans turned to a ‘socialist program’ to save them: Wyoming enacted a law that forces utilities seeking to shut down unprofitable coal plants to to sell them first, and then to buy back the power from the new owner, even if cheaper power is available."
304,"The depth at which some shelled organisms can survive will shrink to 83m from an average of 1,000 meters today as the oceans become more acidic as a result of absorbing CO2"
305,Melbourne poll finds strong majority support for declaring a climate emergency
306,Question: Is there a known reason why science gets easily muddied by partisan politics?
307,2019 Environmental Research Grants
308,I'm a journalist and I'm looking for activists interested in video games
309,"Official Greenpeace Response to Trump and ""Greenpeace founder"" Patrick Moore"
310,Energy Innovation &amp; Carbon Dividend Act (HR 763)
311,100 Solutions to Climate Change [Ranked]
312,Shell urges Trump White House to tighten methane leak rules
313,"It Took a While, But California Is Now Almost Completely Out of Drought"
314,C-SPAN Washington Journal
315,Climate study warns of vanishing safety window—here’s why
316,My Kids Will Skip School This Friday. Here’s Why I'm Letting Them.
317,Climate vs Weather: what the difference is
318,Fresh iceberg ruptures in Chile's Patagonia raise alarm
319,"Church-Tower Clock stops at 11:55 to support climate strike (Zurich, Switzerland)"
320,Where is Congress’ Center on Climate Change?
321,New York City Mayor Bill de Blasio announced on Monday that public schools would be participating in “meatless Mondays” in an attempt to combat climate change.
322,'We won't stop striking': the New York 13 year-old taking a stand over climate change | Alexandria Villasenor is among the American student activists joining the global fray and helping to organize the first nationwide strike on 15 March
323,"Climate change costs will have knock-on effect on interest rates, Reserve Bank warns"
324,"Radical proposal to artificially cool Earth's climate could be safe, new study claims"
325,Thousands of children will be handed a free pass out of school to attend climate change protests throughout Scotland on Friday
326,A High Stakes Game of Beat the Clock
327,Contemplating the end of the world with Extinction Rebellion
328,The Path to Climate Justice Passes Through Caracas
329,New record temperature set in Western Australia.
330,Alexandria Ocasio-Cortez legitimized anxieties about climate change and having children - Vox
331,"'We’ve been forced into this': Australia's school climate strikes to go global - Up to 50 rallies are planned for 15 March. This time, the students will be joined by others in America and Europe, in what has become a global movement. “No new fossil fuel projects, 100% renewables by 2030.”"
332,UK's initial progress on carbon cutting starts to slow
333,"Today 58% of Dutch citizens are worried about climate climate change (up from 35% in 2008), 11% skeptical (down from 24%)"
334,Deforestation - is it related to Global Warming?
335,"Few pathways to an acceptable climate future without immediate action, according to study"
336,"When it comes to what climate goals we should be aiming for, there are a lot of ""magic numbers"" floating around - 2 degrees, 12 years, 350ppm, net zero emissions, and more. Here's a short thread explaining the scientific basis--or lack thereof--for each."
337,A vision for what the world would look like if we stabilized the climate
338,Looking for a climate model recommendation...
339,"Deep Time, This Time"
340,Tens of thousands march for stronger climate change policies in the Netherlands
341,Private jets receive ludicrous tax breaks that hurt the environment
342,It’s time for a Climate Trade War
343,How climate change affects extreme weather around the world: a map showing locations where there are extreme weather related studies
344,"Idaho lawmakers hold 1st climate change hearing — and no one argued about its existence, causes"
345,The bogus number at the center of the GOP’s Green New Deal attacks - Republicans' estimates that the climate plan would cost $93 trillion are based on a think tank study that doesn't endorse that total.
346,Valid counter arguments
347,"Let’s support the Green New Deal | If we care about the future of life on Earth, continuing to do nothing is not an option."
348,How one small city sowed the seeds for its own Green New Deal
349,Thousands attend climate march in Dutch capital
350,America can afford a Green New Deal – here’s how
351,"Don’t ignore military advice on climate change, Mr. President. Now is the time for Mr. Trump to listen to generals and admirals — they’re telling him of a grave threat to our national security that we cannot ignore."
352,"Striking for the future: From Australia to Japan to India, youths will skip school on March 15 to protest against climate change. They will join their peers in the Americas and Europe"
353,How much carbon do we need to capture to keep the planet below a 2 degrees increase?
354,Books/Resources to become more educated about climate change?
355,"I was trying to figure out for myself how much the sea level would rise (approximately) if all the ice on the planet melted, so I looked up these numbers on Google and did some math. I'm not a scientist or mathematician, so I wanted to ask y'all if my process is correct or not. What do you think?"
356,Resurfaced Video Shows Bernie Sanders Criticizing Media for Not Covering Climate Change in 1989
357,"Oil, lipids and carbohydrates Emulsion into paste like substance."
358,"When it comes to what climate goals we should be aiming for, there are a lot of ""magic numbers"" floating around - 2 degrees, 12 years, 350ppm, net zero emissions, and more. Here's a short thread explaining the scientific basis--or lack thereof--for each."
359,"Former security officials to Trump: Stop trying to undermine climate science - ""It's dangerous to have national security analysis conform to politics,"" say 58 former military and security officials in a letter to the president."
360,For a Fighting Ecological Trade-Unionism
361,Greta Thunberg: The disarming case to act right now on climate change
362,Markey On The'Green New Deal': 'We Should Not Be on the Defensive'
363,Jay Inslee Jumps Into 2020 Fray on Climate Issue
364,UK will miss its climate goals unless housing emissions are tackled
365,"Global carbon dioxide levels measured atop Mauna Loa set a new monthly record: For decades, a small research lab atop Mauna Loa has measured carbon dioxide levels in the atmosphere."
366,"MIT researchers warn killer heat waves soaring above temps humans can survive will be regular occurrences within our lifetimes in areas affecting over 500 million people. Areas of China, South Asia and the Persian Gulf will become uninhabitable by 2070 if climate change remains unchecked."
367,Hey grandpa what did you do during the green energy revolution?
368,Renewable Problems—Wind &amp; solar energy not an easy transition from fossil fuels—Ashes Ashes #58 (audio)
369,"The pressures of climate change and population growth could cause water shortages in most of the United States, preliminary government-backed research said on Thursday."
370,Scientists Must Speak Up for the Green New Deal | The resolution’s focus on climate and social justice highlights the central challenges—and opportunities—of our time
371,House Dems Push Back on 'Secret' White House Climate Committee
372,Lisa Murkowski and Joe Manchin: It’s time to act on climate change
373,"What are the first things caused by global warming non-scientific people will start to notice, which will have a real negative impact on their lives?"
374,How brain biases prevent climate action
375,Trump’s new science adviser says it’s not his job to correct the president on climate change
376,David Wallace-Wells alarming interview on Joe Rogan's podcast. Wow.
377,Arctic amplification is caused by sea-ice loss under increasing CO 2 | Nature Communications
378,The US Is Responsible For 26% Of Global Warming Emissions &amp; Is Morally Responsible To Help Solve It
379,"U.S. and Canadian oil production pushing planet's climate goals out of reach, says IEA"
380,Concrete is tipping us into climate catastrophe. It's payback time
381,Blogging for the planet as a busy father of two
382,David Suzuki implores young to act on climate change
383,'Crazy' to ignore climate change security threats. Retired Rear Admiral David Titley on why he and 57 other military experts are criticizing the President's plan to counter government findings on climate change.
384,"""Climate Science is 'more accuate' than physics."" Is this claim remotely true?"
385,Where to host a climate strike
386,"America’s Light Bulb Revolution: The shift to efficient lighting has driven down electricity demand in American homes, saving consumers money and cutting greenhouse emissions."
387,Carbon Tax Plans: How They Compare and Why Oil Giants Support One of Them
388,The Conservative Texas Mayor Leading the Charge With Renewable Energy Talks About the Green New Deal
389,"Norway, a country that has built is wealth with oil, has today decided to cut oil and gas shares"
390,"The Green New Deal’s army- Millennials and Generation Z have no choice but to take on the battle against climate change. We need to have a planet, a home, if we plan on fixing all of the baby boomers’ other mistakes."
391,A Trump official said seismic air gun tests don’t hurt whales. So a congressman blasted him with an air horn.
392,"McConnell, stop ignoring Kentucky youth who support a Green New Deal | We are your constituents and future constituents. We live in Kentucky neighborhoods, go to Kentucky schools and drink Kentucky water. And we support a Green New Deal."
393,Appreciating the Sunrise | Living with Climate Change
394,New Zealand student strike over climate change gets support from teachers. An open letter to Prime Minister Jacinda Ardern penned by academics has received more than 1000 signatures in support of the strike.
395,The Negative Impacts of Climate Change On Various Animal Species
396,"Many Climate Change Bills Are Still Alive, Including A Carbon Tax: At the session’s halfway point, several new measures have support. But some current initiatives will expire if action isn’t taken."
397,More efficient form of carbon sequestration using chemcar via sulfuric acid dehydration of biomass? Random idea from a non-chemist concerned about the climate.
398,College Students Calling out Climate Denial Machine That’s Older Than They Are. Brown climate development lab students recently compiled and published a report giving the backstory on a dozen climate denial coalitions.
399,How climate change is fueling extremism: Terrorist organizations capitalize on the devastation wrought by climate change to attract new members
400,"Deep Argo floats start sampling the ocean below 2000m depth, and find that warming has accelerated in the deepest waters of the South Pacific"
401,Arnold Schwarzenegger and Kevin de León are teaming up to tackle greenhouse gas emissions from the transportation sector
402,"Despite What Trump Says, Climate Change Threatens Our National Security: The president is trying to subvert the science that informs the intelligence community. -- General John R. Allen and David G. Victor"
403,Ruth Mundy- Love in the Time of Coral Reefs
404,College Republicans Want Their Party to Confront Climate Change
405,Several states and countries are moving toward banning new residential natural gas hookups
406,Finding Hope in Panic
407,The Other Kind of Climate Denialism
408,What will it take for Wisconsin to stop burning coal?
409,Trump Said to Again Seek Deep Cuts in Renewable Energy Funding
410,"GCMs have systematically over-estimated the strength of a negative cloud-phase feedback, implying a considerably higher climate sensitivity to CO2 (possibly around 5.5 C per CO2 doubling) than past studies have led us to believe"
411,Rain melts Greenland ice even in winter
412,When Will Climate Change Make the Earth Too Hot For Humans?
413,Mitch McConnell wants a Green New Deal vote. Democrats should take him up on it.
414,"Feinstein’s Green New Deal is ‘like shifting to Deck B on the Titanic,’ progressives say"
415,Cities Can Lead On the Green New Deal
416,Will the next economic boom be climate catastrophe mitigation?
417,The Climate Change Paper So Depressing It's Sending People to Therapy
418,Anybody have a point by point takedown of this nonsense video?
419,Schumer Calls for Bipartisan Panel to Craft Climate Change Legislation
420,"U.S.’s wettest winter on record is a ‘glimpse of the future under climate change’ -- ""A consequence of global warming is that the extremes around the world increase."" Precipitation records in the winter are precisely what scientists have predicted as climate change intensifies."
421,The vanishing point: life on the edge of the melting world
422,The study on collapse they thought you should not read – yet
423,The Trump administration's efforts to undo rules aimed at reducing greenhouse gases would lead to a rise in annual emissions of more than 200 million metric tons by 2025 and thousands more American deaths
424,Why Good Politics And Good Climate Science Don’t Mix
425,Who Will Be the 2020 Climate Candidate? There Are Lots of Choices
426,America can afford a Green New Deal — here's how
427,Visualization of how the Antarctic Thwaites Glacier ice shelf flow speed has accelerated by ~60% in the past two years.
428,"Support is surging for teens’ climate change lawsuit | The U.S. Constitution protects the right to a safe climate, say 30,000 kids and eight members of Congress in support of the suit."
429,Michael Bloomberg goes from funding a campaign to end coal use to funding one to end all fossil fuel use
430,Trump climate deregulation could boost CO2 emissions by 200 million tonnes a year: study
431,"California winter rains used to ward off summer wildfires — but not anymore thanks to warmer, drier summers"
432,Republicans Who Couldn't Beat Climate Debate Now Seek to Join It
433,Time is Short for the Carbon Budget
434,How Google's DeepMind is Using AI to Tackle Climate Change
435,"Facing Pushback, Senator Markey Makes the Case for the Green New Deal"
436,The Good News About a Green New Deal
437,Markets Don’t Buy Republican Skepticism on Climate Change: Investors who put money at risk behave as if it’s not a hoax.
438,What Greenland ice cores say about past and present climate change
439,The province of Alberta has a carbon tax which allows some of the money to be spent on emissions reduction projects. This is where it went.
440,"White House plans to counter climate change ‘will erode our national security,' 58 former officials warn | Generals, admirals and other national security officials sent a letter to Trump objecting to plans to convene an ad hoc panel to counter federal climate reports."
441,What can a technologist do about climate change? Non-political actions you can take
442,"The English Diggers, the ""Commons,"" and the Green New Deal"
443,Coastal states mount bipartisan resistance as Trump forges ahead with offshore drilling plans
444,White House drafts guidelines for panel questioning climate threat to security
445,"In addition to cutting emissions of greenhouse gasses, adapting to the warming from emissions which have already happened is important. This is how the UK plans to do that."
446,"The big problem with climate 'realism' | If you study the conclusions of climate science even cursorily, the truth is that we have procrastinated so long that we pretty much have to go full-tilt at everything with a decent chance of getting emissions down."
447,"The Ocean Gets Heat Waves Too, and They Are Threatening Marine Ecosystems - there were more than 50 percent more heat-wave days between 1987 and 2016 than there were between 1925 and 1954"
448,Undergraduate Interest - Climate and Mental Health
449,Stop Public Funding for New Non-renewable Energy Projects (UK)
450,Italy sees 57% drop in olive harvest as result of climate change
451,In the Finnish Youth Climate Summit there was a touching video made for climate youth
452,Climate change art: clothes and crafts inspired by global warming stripes
453,"Heatwaves sweeping oceans ‘like wildfires’, scientists reveal"
454,Land management ‘blind spots’ make 1.5C goal highly unlikely
455,Europe’s renewable energy policy is built on burning American trees
456,"Girl Scouts make climate change part of their curriculum: ""There has been a huge movement in Girl Scouts to get girls more involved in STEM and the outdoors."""
457,"Droughts and Floods May Level Off until 2050, but Then Watch Out: Strange waves in the jet stream foretell a future full of heat waves and floods | Michael Mann"
458,O desaparecer das nuvens trás nova ameaça
459,"On March 15, the Climate Kids Are Coming"
460,Adults failed to take climate action. Meet the young activists stepping up: Some are calling climate change this generation’s civil rights movement. These are the young activists leading the charge
461,Climate change risks: looking at risk as a probability over a range of temperature and time
462,New Online Course: Making Sense of Climate Science Denial
463,The movement of millions from the global south to the north would be carbon-ageddon for the Arctic.
464,"Ocean heat waves are becoming more frequent. From coral reefs to kelp forests to sea grass beds, they are destroying the framework of many ocean ecosystems."
465,Greta Thunberg's guidelines for the #SchoolStrike4Climate
466,"A large majority of registered voters in the US (85%) – including 95% of Democrats and 71% of Republicans – support requiring utilities in their state to produce 100% of their electricity from clean, renewable sources by 2050"
467,"If we want to build an all-renewable future, we need either to be much more efficient about how we use several metals and rare earths, or greatly expand mining"
468,"Using electric cars cuts greenhouse gas emissions, even in areas which rely on coal to generate elctricity"
469,"Pressed by Climate Activists, Senate Democrats Plan to ‘Go on Offense’"
470,The climate change lawsuit that could stop the U.S. government from supporting fossil fuels
471,China’s Ambitious Plan to Build the World’s Biggest Supergrid
472,Trump's new climate panel is a waste of time and money
473,"Green New Deal vs. Carbon Tax: A Clash of 2 Worldviews, Both Seeking Climate Action"
474,looking for help with climate change project
475,Government sued over climate change
476,Students across the US are planning to walk out on 3/15 to call for climate action. This is their platform
477,Most of Western Europe plans on banning new gas cars by 2030. Here in the US we're not even really having that conversation. I hope as we go through the primary process and into the general election that voters start having that conversation.
478,Terrifying assessment of a Himalayan melting: New report predicts the impact of climate change on Nepal’s mountains may be much worse than we thought
479,"Wallace Smith Broecker, the 'grandfather' of climate science, leaves a final warning for Earth"
480,Ocean warming has caused ‘sustainable’ fish stocks to drop by 4% since 1930s
481,"Has climate changed? If so, can it be reverted?"
482,Carbon farming: how agriculture can both feed people and fight climate change
483,Flood-prone cities like Houston may need to start buying people out
484,Prices are not enough: why we need to more than just set a price on carbon
485,California’s Wildfires Burn Through America’s Climate Illusions
486,Climate Change Is Here—and It Looks Like Starvation
487,"Hi guys, I wrote an essay on how climate changes effects polar bears, would love to hear your thoughts."
488,China’s CO2 emissions surged in 2018 despite clean energy gains
489,Decentralized climate strikes are being organized by hundreds of thousands of youth all across the world.
490,Jay Inslee: First Democrat running for president on climate change
491,"Fear, Hopelessness and How to Proceed"
492,Greenpower: Inspiring the Engineers of Tomorrow - The Planetary Press
493,Time's Up: 3 Reasons why gradualism won't save us
494,"Climate Change Ain’t the First Existential Threat: People of color know about building movements, about courage, about survival"
495,Climate change threatens Two of Ecuador's Seven glaciers
496,That Green Growth at the Heart of the Green New Deal? It’s Malignant
497,"Weather, and especially extreme weather, is how most people will experience climate change...So how we talk about that is really important."
498,Teen Climate Activist to US Senator Dianne Feinstein: We Need the Green New Deal to Prevent the Apocalypse
499,Speaker of the US House of Representatives Nancy Pelosi Won't Say Climate Panel Can't Take Fossil Fuel Donations
500,Climate change Catch 22
501,"We’re James Lewis and Ethan Freedman, we work for Rainforest Trust, an organization that protects land for endangered species like lemurs, gorillas and turtles across the tropics with local conservation organizations. Ask us anything! (follow link)"
502,Media reaction: The UK’s record-breaking winter heat in 2019
503,The Green New Deal is already changing the terms of the climate action debate
504,Senators Call On Trump to Abandon Plan to Form Anti-Science Panel
505,The Senate just confirmed a former coal lobbyist to lead the EPA
506,Physicist leading Trump’s ‘adversarial’ climate review also led group touting carbon emissions
507,Could 'climate delayer' become the political epithet of our times?
508,Our obsession with plastic waste is distracting us from bigger environmental challenges
509,Republican Representative Paul Gosar suggests that photosynthesis discredits climate change
510,"Climate Change Is Already Cutting Into the Global Fish Catch, and It's on Pace to Get Worse | Some regions, including the Sea of Japan and the North Sea, have been hit harder than the global average, with an estimated decline in sustainable catch between 15 and 35 percent"
511,Jay Inslee just launched a presidential campaign that will be all about climate change - The governor of Washington wants to make climate change the most important issue of 2020.
512,"With a focus on climate change, Washington Gov. Inslee enters 2020 presidential race."
513,St.Pölten
514,Alex Steffen is one of the most important writers on where climate is going and what we need to do IMHO. He's got a book project that needs some backing! Help launch a bold new book about the end of predatory delay and the beginning of rapid climate action.
515,"Fuck me, ot the Climate!"
516,St.Pölten Students are marching!
517,Australia records hottest-ever summer
518,Homo Sapiens – Mother Earth’s metastatic cancer?
519,Downing Street has the nerve to call the schoolchildren’s climate strike “truancy” but when climate change is debated for the first time in two years just 10 MPs sat on government benches
