,0
767,"Michael Mann on why people DON'T believe in climate change, why people who DO believe in climate change aren't willing to act, and what YOU can do today to help reduce your impact and influence policy to achieve the needed worldwide end to fossil fuel consumption"
768,"“Our next President should declare a #NationalEmergency on day 1 to address the existential threat to all life on the planet posed by Climate Change,”"
769,Why the Green New Deal makes me hopeful about climate change
770,What Green New Deal advocates can learn from the 2009 economic stimulus act
771,Climate Cartoon of the day - School Strike!
772,Global Temperature Fluctuation 1884-2018
773,"The Great Backyard Bird Count is citizen science on a global scale, and it’s more crucial than ever in the age of climate change (x-post r/EarthApproach)"
774,Kids skipping school to protest climate change isn't just reasonable—it's logical
775,Rising Tides Will Sink Global Order
776,"World headed for warmest period on record, says Met Office"
777,How to decarbonize America - and the world - Ramez Naam
778,"What do we know about the ""methane mystery""? A review paper in PNAS on contemporary trends in atmospheric methane (open-access; x-post /r/science)"
779,From Marx to Ecosocialism
780,Meet the millennials grieving for the future of planet Earth
781,"Decarbonizing buildings: it’s tedious, but oh so necessary. A California coalition is tackling one of the hardest, unsexiest parts of climate policy: existing buildings"
782,‘The most villainous act in the history of human civilisation.’ Michael E Mann speaks out
783,"Urgency in climate change advocacy is backfiring, says Citizen Potawatomi Nation scientist"
784,Scientist who resisted censorship of climate report lost her job. She said supervisors at the park service yelled at her and threatened to kill the report or remove her name if she would not agree to the changes.
785,A photo of students hijacking a tourbus in inner London outside parliament today advocating for action surrounding climate change.
786,Why Pennsylvania needs to ditch fracking and get a Green New Deal of its own
787,"Why America's Northernmost City Is Having a Weird, Hot Winter"
788,Thousands of schoolchildren in London skip school to call for action on climate at Downing Street
789,"'If not us, who?' Failure of representation drives youth climate strike | As a movement grows across the world, young people say they want politicians to protect their interests"
790,Carbon capture on power stations burning woodchips is not the green gamechanger many think it is
791,'I love calling out politicians': meet the student suing Trump over climate change
792,Thousands of children in London have walked out of school to stage a massive climate change protest outside Downing Street
793,"If Not the Green New Deal, Then What? Alexandria Ocasio-Cortez's proposal has countless critics. We asked two of them to share their good-faith alternatives for reversing climate change."
794,Senate Dems on Green New Deal debate: 'Bring it on'
795,UK Met Office: One-in-10 chance warming could ‘temporarily exceed’ 1.5C within five years
796,'The beginning of great change': Greta Thunberg hails school climate strikes | The 16-year-old’s lone protest last summer has morphed into a powerful global movement challenging politicians to act
797,"Likely 2020 Voters Support Parts Of Green New Deal, Despite Reservations Over The Cost"
798,Thousands of students are set to go on strike at 11am on Friday as part of a global youth action over climate change. Strikes are taking place in 60 towns and cities across the country from Cornwall to the Scottish Highlands.
799,"More than 10,000 people, mostly young people, demanded on Thursday urgent measures to stop climate change during a protest in Brussels. This is the sixth student mobilization in the last month, called to demand from the authorities greater involvement in the fight against global warming."
800,The Transformative Power of Climate Truth
801,What is the Green New Deal and how would it benefit society?
802,Want to take action to support the Green New Deal? Senators have local offices in their home states (often several). Join others by walking in Feb 18-22 and letting the staff know that you'd like your senators to support it.
803,Acting EPA Chief Appoints Climate Denier John R. Christy to Science Advisory Board
804,"Dividend and Fee Carbon Taxes: the case for paying out first, collecting the carbon tax second"
805,New Report Warns Geoengineering the Climate Is a 'Risky Distraction'
806,"Tennessee Valley Authority Board of Directors Follow Expert Analysis, Retire Two Uneconomic, Dirty Coal Units"
807,Republicans are trolling the Green New Deal. Here’s how Democrats will troll them back.
808,The Green New Deal Is What Realistic Environmental Policy Looks Like
809,Judge: US must reconsider climate impacts of Montana mine
810,"FDR's New Deal faced similar backlash as Green New Deal, historian says"
811,Carbon Dioxide Parts Per Million Tracker?
812,"How Switzerland is expecting the melting of their glaciers to accelerate, and the adaptation measures they're talking about to deal with the resulting loss of hydroelectric generation"
813,Global warming and industrialised farming are damaging vital ecosystems
814,Polluter-backed misinformers are trying to kill carbon-pricing plans in the states
815,"In Germany, the Green New Deal Actually Works"
816,"Acting Environmental Protection Agency chief Andrew Wheeler downplayed last year's dire federal government report on climate change, saying some of the report's conclusions ""were based on the worst-case scenario"""
817,Deeper Ties to Corporate Cash for Doubtful Climate Researcher
818,We have to unify our species if we are going to survive on Spaceship Earth. Hedonism is the ideology that can make it happen.
819,A neat mental trick to understand the climate battle ahead: Pretend It’s Aliens
820,Highly Unusual Upward Trends in Rapidly Intensifying Atlantic Hurricanes Blamed on Global Warming by Dr. Jeff Masters | Category 6
821,Earth Is 'Missing' at Least 20 Ft of Sea Level Rise. Antarctica Could Be The Time Bomb
822,"California lawmakers say Green New Deal will fight global warming: “The science is clear: unless we take immediate and bold action, the safe and clean future we envision for our children and grandchildren will not exist.”"
823,‘The most villainous act in the history of human civilisation.’ Scientist Michael Mann speaks out
824,Can This Old House Save The Planet? How Existing Buildings Could Fix Climate Change
825,The UK is one of the most nature-depleted Countries in the World
826,Scientists study past volcanoes in B.C. to understand climate in the future
827,"Can the Democracies of Today Survive a Serious Climate Crisis? ""If we don't deal with climate change, we're facing a very brutal collapse of civilisation"""
828,How to Cut U.S. Emissions Faster? Do What These Countries Are Doing.
829,Fuel to the Fire: How Geoengineering Threatens to Entrench Fossil Fuels and Accelerate the Climate Crisis
830,Couldn’t agree more
831,"The proportion of Americans found to be ""alarmed"" by climate change has doubled in five years, the pollsters behind a nationwide survey revealed on Tuesday."
832,"Green New Deal is good economics | If we want to save the planet for the least amount of money, we need the Green New Deal, and we need it now."
833,A “Socialist Fever Dream”: Can the G.O.P. Turn A.O.C. into 2020 Kryptonite? Mitch McConnell hopes to turn the Green New Deal into an electoral nightmare. But polling shows the voting public may be more aligned with Ocasio-Cortez than Republicans think.
834,"The Green New Deal Is Just the Vague, Audacious Goal We Need"
835,"As lawsuits over climate change heat up, oil industry steps up attacks on its critics"
836,The War Against Solar Energy - How Private Companies are fighting to stop block the sun
837,Klimabloggen
838,This Scary Map Shows How Climate Change Will Transform Your City
839,Ocasio-Cortez says we need World War II-scale action on climate. Here’s what that looks like
840,"Climate Change, Urban Growth, and Unsustainable Population Growth"
841,"Senator Mitch McConnell announced that, in a cynical political ploy, he will rush a vote on the Green New Deal resolution proposed by Senator Markey and Representative Alexandria Ocasio-Cortez rather than allowing it to go through the hearings and legislative process it was intended to have"
842,"Corsia: The UN’s plan to ‘offset’ growth in aviation emissions after 2020 provides for monitoring of aviation emissions, but only very slight cuts to actual greenhouse gas emissions"
843,Two sub-reddits to take action against climate change.
844,Decade Old Song Predicts Inaction for Climate and Current Crises
845,Climate-analog mapping is a statistical technique that quantifies the similarity of a location’s climate relative to the climate of another place and/or time. Looking at 540 cities they concluded that relative climate will shift south by 850km by 2080.
846,What will your city be like by 2080?
847,Just how much ice is left outside of Greenland and Antarctica?
848,"Today’s Earth looks a lot like it did 115,000 years ago. All we’re missing is massive sea level rise."
849,"Losing climate change race a 'disaster for Africa,' UN says"
850,Research into direct air capture of CO₂ is an ongoing effort: this company is trying to get the cost down enough that it can make a difference
851,Climate scientist Warren Washington will be awarded the Tyler Prize for Environmental Achievement; he was one of the first people to build a computer model of the atmosphere
852,"How Climate Change May Affect Winter ""Weather Whiplash"""
853,The last five years have been Earth’s warmest since records began
854,"Showing that large organizations can cut emissions to zero, Brown University pledges to reduce campus greenhouse gas emissions to net-zero by 2040"
855,"Tom Suozzi, Moderate Democrat On Powerful Economic Committee, Backs Green New Deal"
856,How A General-Turned-Oil Lobbyist Helped Push Through The Dakota Access Pipeline
857,"Reactionaries Call the Green New Deal ‘Radical,’ Like That’s a Bad Thing"
858,"New Legislation Aims to Avert Arctic Giveway to 'Corporate Polluters' Sneaked Into GOP Tax Scam: Announcement comes as scholars warn fossil fuel drilling in Arctic refuge ""would contribute to the escalating crises of climate change and biological annihilation."""
859,Slowing climate change could reverse drying in the subtropics
860,"Global Poll Reveals Surging Fear of Climate Crisis and US Power Under Trump: Over the past five years, from the U.S. to Poland to Kenya, the number of people worried about the climate crisis has risen by double-digits."
861,"In response to public pressure, Los Angeles ditches plan to invest billions in fossils fuel burning power plants"
862,Big Oil wants you to vote for climate destruction
863,Shouldn't each year be the hottest year on record since a given date if Global Warming is a thing?
864,Climate change is the overlooked driver of Central American migration
865,Toronto climate change and snowstorms
866,CleanBC vs LNG. Here's the 'missing chart' that explains the gap (xpost r/StopFossilFuels)
867,State of Emergency Declared As Dozens of Polar Bears Invade Russian Town
868,Is Fertilizing the Ocean the Key to Solving Climate Change?
869,"Even with the cold snaps, the US is warming: 23 of the past 30 winters were warmer than average for the 20th century. Cold places have warmed the most."
870,Kids climate plaintiffs ask court to halt US federal fossil fuel leases
871,A question about global warming
872,Landmark Australian ruling rejects coal mine over global warming - The case is the first time a mine has been refused in the country because of climate change.
873,The natural gas boom is a bridge to nowhere but higher temperatures
874,"Floods, fire and drought: Australia, a country in the grip of extreme weather bingo"
875,Worried about warming
876,Chevron Pledges Alignment With Paris Accord But Won't Cap Output
877,Donald Trump Still Doesn’t Understand Climate Change Science
878,"""I've seen things you people wouldn't believe..."" (Climate Change Edition)"
879,Mike Mann on the Arctic “Methane Bomb”
880,Watching the World Burn: Truthout Readers Share Their Climate Stories
881,Climate and contradiction in Marx’s theory of history
882,"Climate Change and the Problems of Neoliberalism: ""Climate change has to be treated like war"" and ""euthanizing the the fossil fuel industry"" and ""states ... have to nationalise industries, set production targets"""
883,"A quick discussion of why a carbon tax, on its own, isn't enough: for industries other than electric generation, the replacements are new and expensive, and forcing a switch is going to need either a very high (and politically difficult) carbon tax, or a mix of subsidies and regulation"
884,Students Are Preparing for the First Major U.S. Climate Strike Next Month
885,‘The Human Element’ makes the impacts of climate change feel real A photographer documents how global warming is already affecting people’s lives.
886,The truth about big oil and climate change
887,Munich RE - 2018 Natural catastrophe review - Natural Catastrophe losses topped $160 billion last year.
888,Climate change: focusing on how individuals can help is very convenient for corporations
889,Judge blocks Australian coal mine in landmark climate change ruling - Institute for Energy Economics &amp; Financial Analysis : Institute for Energy Economics &amp; Financial Analysis
890,"About 30 years ago, the physicist Carl Sagan gave a talk on why he took concerns about global warming seriously."
891,Hyundai Faces Superbowl Ad Backlash | Digs deeper into Environmental graveyard
892,There’s now an official Green New Deal. Here’s what’s in it.
893,"President Trump, here’s ‘what the hell is going on’ with global warming"
894,Twitter Schools Donald Jr. After He Rips Ocasio-Cortez's Green New Deal As 'Socialism'
895,How the Green New Deal is shaping the race for president
896,"Alexandria Ocasio-Cortez’s Green New Deal Should Nationalize Utilities | PG&amp;E is asking for a bailout. Instead, we should make that utility, and all utilities, public assets."
897,"'This Is What Hope Feels Like': Green New Deal Resolution Hailed as 'Watershed Moment' for New Era of Climate Action. ""When we look back on today, this will be the moment we will be able to say that the political tide has turned on the rising seas."""
898,Australian court rejects coal mine on climate grounds
899,A ‘Green New Deal’ sounds like pie in the sky. But we need it.
900,"For the first time, the climate skepticism—and sometimes outright denial—that has dominated congressional hearings for the past decade was presented as a minority view, as it is among the scientific community."
901,Green New Deal PDF
902,"A growing number of US governors — including in Colorado, California and New Jersey — are floating plans for their states to get all of their electricity from carbon-free sources"
903,"Hurricanes are strengthening faster in the Atlantic, and climate change is a big reason why, scientists say"
904,"On Thursday, Representative Ocasio-Cortez debuted a blueprint for a Green New Deal, an ambitious plan that aims to transform the American economic juggernaut into a massive weapon to combat climate change."
905,Polar melting: 'Methane time bomb' isn't actually a 'bomb' Researchers cast doubt on one of the scariest ideas in climate science.
906,Global Average Temperature Rising About 3x Faster Over Land Than Water
907,This is pretty awesome given the general approach to mining and climate change adopted by our politicians.
908,"Hurricanes are strengthening faster in the Atlantic, and climate change is a big reason why, scientists say"
909,"A Huge Climate Change Movement Led By Teenage Girls Is Sweeping Europe. And It’s Coming To The US Next. A climate march last weekend in the Belgian capital, Brussels, drew more than 100,000 people"
910,A Green New Deal can give us the freedoms to allow humanity to flourish
911,Question about anthropogenic water vapor emissions
912,The Polar Vortex Is Climate Disruption in Action
913,100% renewable electric generation for North America is lower in cost than a business-as-usual scenario.
914,Methane hydrates: What you need to know
915,Seven take-aways from the Green New Deal launch
916,"saw this on climate march and it made my day (translation earth: dying, government: )"
917,In the US? Here's a script you can use to call your reps for supporting the Green New Deal
918,https://infinite-coincidence.com/2017/11/17/heres-why-some-trump-supporters-will-never-abandon-him/
919,Government under fire for burning down forests as solution to climate change
920,"Trump Touts Infrastructure in State of the Union; Ignores Climate Change - Extreme weather events must be factored into infrastructure upgrades, experts say"
921,"Page 7, Line 8: the GreenNewDeal does not exclude nuclear"
922,Ecosocialism – A Brief Description
923,"With The Planet In Crisis, Congress Is Here To Talk About Climate Change"
924,"Trump's speech ignored global warming and climate disasters, but Americans are more worried than ever"
925,Democrats Put GOP in Hot Seat With a Month of Climate Hearings
926,"House Democrats hold hearings to increase pressure on climate change | Nazar, 17, testified that she will be 28 years old in 2030 when scientists say the world will need to have already made major efforts to avoid the worst of climate change."
927,The Green New Deal’s Five Freedoms | A radical Green New Deal would open up enormous possibilities for human flourishing — and allow us to reclaim the language of freedom from the Right.
928,"Agroecology is helping 100,000 farmers in the Sahel become more resilient to climate change"
929,2018 was one of the warmest years on record – and the next 5 years could be even hotter
930,Alexandria Ocasio-Cortez Unveils Landmark Green New Deal Resolution
931,Youth for Climate - The Hague. It was huge.
932,Climate Change will have devastating impact on Himalayas and Karakoram Ranges
933,"'A Red Screaming Alarm Bell' to Banish Fossil Fuels: NASA Confirms Last Five Years Hottest on Record - ""We're no longer talking about a situation where global warming is something in the future. It's here. It's now."""
934,Achieving the Paris Climate Agreement Goals
935,Patagonia’s CEO is donating company’s entire $10M Trump tax cut to fight climate change.
936,"Natural variability is very unlikely to explain the recent string of warm years, but human releases of greenhouse gasses into the atmosphere makes them likely"
937,"2018 Fourth Warmest Year in Continued Warming Trend, According to NASA | Last 5 all the hottest on record"
938,"2018 Climate Change Report: Globe Fourth Warmest Year, Nine of 10 Warmest Years Have Occurred Since 2005"
939,Earth just experienced one of the warmest years on record
940,Studies shed new light on Antarctica’s future contribution to sea level rise
941,NOAA global climate analysis for 2018
942,A Nobel Prize for fighting climate change? Seattle couple proposes a world-changing recognition
943,The Clean Energy Puzzle Needs Nuclear
944,David Suzuki: Winter weather doesn’t disprove global warming
945,"The warming effect of the CO2, over its lifetime in the atmosphere, from burning a lump of coal is more than 100,000 times greater than the direct heating from the burning itself"
946,It’s Official: 2018 Was the Fourth-Warmest Year on Record
947,"Surprise, there's a six-mile hole under Antarctica"
948,A Green New Deal to Win Back Our Future
949,The Story Behind the Green New Deal’s Meteoric Rise | How twelve young activists forced a bold idea into the mainstream of the Democratic Party
950,Green New Deal Resolution Poised To Shake Up Democrats' Foreign Policy Debate
951,Climate change: UK CO2 emissions fall again
952,"The Pentagon’s latest climate-change report was so bad that it didn’t even meet legal requirements, say House lawmakers who on Wednesday ordered the military to redo the document by April 1."
953,Louisiana and Isle de Jean Charles Tribe Seek to Resolve Differing Visions for Resettling ‘Climate Refugees’
954,"Michael Mann. Tell me, was he right?"
955,"A landscape unseen in over 40,000 years"
956,The northeast US used to have an industry of shipping frozen lake ice to the tropics. Warming is going to leave thousands of lakes warm enough that they don't freeze every winter.
957,"Australia just had its warmest month on record, with ""unprecedented"" extremes. Heat waves and wildfires are projected to become more widespread and severe in Australia as the climate continues to warm."
958,The False Choice Between Economic Growth and Combatting Climate Change
959,What Democrat presidential hopefuls do (and don't) say about the Green New Deal
960,The False Choice Between Economic Growth and Combatting Climate Change
961,Big money is undermining the fight against climate change
962,"The U.S. Could Use a Green New Deal | Americans increasingly see climate mitigation as a patriotic duty, as they should. Done well, a Green New Deal, like the one that inspired it, can bring them together and help their country succeed."
963,"Michigan's New Governor Puts Climate Change at Heart of Government | Gretchen Whitmer created a new office of climate and energy and is the 20th governor to join the U.S. Climate Alliance, committing to the Paris climate principles."
964,"A third of Himalayan ice cap doomed, finds report"
965,"This morning from the Guardian. ""Is climate change way worse than we realise?"" I think most people on this sub would agree that it is, but this book looks like essential reading if we really want to understand the scale and variety of issues we could be facing very soon. PS. Skeptics take note."
966,Naomi Oreskes on Climate Change and the Distortion of Scientific Facts (Sean Carroll‘s Mindscape)
967,Nevada Business Owners Are Pissed With NV Energy
968,Book Excerpt: The Uninhabitable Earth by David Wallace-Wells
969,"Interview with the head of Sierra Club’s Ready for 100 campaign about the growth of the 100% renewable energy movement, and how in the United States cities and states are leading in the face of federal dysfunction."
970,"If Property Rights Were Real, Climate-Destroying Companies Would Be Sued Out Of Existence | Current Affairs"
971,Tasmania is burning. The climate disaster future has arrived while those in power laugh at us
972,"Rising CO2 won’t make trees grow more, study suggests."
973,Governing Geoengineering Research: A Political and Technical Vulnerability Analysis of Potential Near-Term Options
974,Americans say they're worried about climate change – so why don't they vote that way?
975,"Rising Temperatures Could Melt Most Himalayan Glaciers by 2100, Report Finds"
